Titre du document;Fichier;Description du document;Institution;Page;Cote du document;Cote origine;Date du document;Support;Dimensions du document;Source;URL
Traité de Campo-Formio;Traite_Campo_Formio_AE_III_50bis.jpg;"Traité de Campo-Formio entre la République française,
représentée par Napoléon Bonaparte, et l'Autriche, représentée par 
Martius Mastrilli, Louis de Cobenzl, Maximilien de Mervelot et 
Ignace de Degelmann. Acte rédigé en français, daté du 26 vendémiaire an VI
 (17 octobre 1797), à Campo-Formio, Italie.";Archives nationales (France);12 sur 12;AE/III/50bis;AF/III/59/235/1;17 octobre 1797;papier;"33,8 x 21 cm
 Les cachets ont un diamètre d'environ 30 mm";http://www.culture.gouv.fr/Wave/image/archim/Pages/03604.htm;
Vœux du général de Gaulle le 31 décembre 1968;Photographie_Voeux_De_Gaulle_AG_5-1_1057_2080.jpg;"Photographie de Charles de Gaulle
Vœux du général de Gaulle. 31 décembre 1968
© Archives nationales/ Service photographique de la présidence de
La République";Archives nationales (France);1;AG/5(1)/1057/2080;;31 décembre 1968;papier photo;;;
